,url,title,article,keyword(s)
6,https://news.asu.edu/20251113-local-national-and-global-affairs-asus-role-national-security-helping-veterans-praised,"ASU's role in national security, helping veterans praised by congressman","Abe Hamadeh spoke as part of Congressional Dialogue Series

U.S. Rep. Abe Hamadeh (left) and Danny Seiden, president and CEO of the Arizona Chamber of Commerce and Industry, speak during a congressional dialogue event at ASU's West Valley campus on Nov. 10. Photo by Emma Fitzgerald/Arizona State University

When Arizona Congressman Abe Hamadeh travels across Washington, D.C., he is struck by the presence of Arizona State University.

“You can’t escape ASU,” Hamadeh said with a smile Monday at the Congressional Dialogue Series event held at ASU’s West Valley campus. “They have a campus at Washington, D.C. They’re all over the world. So many of the ambassadors who visit my office, they all know what Arizona State University is. They all want to visit soon.”

Hamadeh was the third invited guest for the Congressional Dialogue Series, hosted by ASU’s Office of Government and Community Engagement.

US Rep. Andy Biggs talks Arizona’s energy path forward at ASU event

Sally Morton, executive vice president of the Knowledge Enterprise, thanked Hamadeh for the work he’s done on behalf of students and veterans, and the work being done at ASU to strengthen Arizona’s role in national security and defense innovation.

“This event is an opportunity to showcase what we do here,” Morton said. “We’re trying to be real responsive in real time as events are happening so quickly. The last one we did with Congressman (Andy) Biggs was about energy for artificial intelligence, which is a huge issue for the Valley and state, as well as the nation. Today we’re talking about national security and some of the ways ASU answers the nation’s call.”

Todd Sandrin, vice provost of the West Valley campus, said having Hamadeh on campus was meaningful because ASU’s mission and District 8, the district in the West Valley Hamadeh serves, are “deeply connected.”

“Through our workforce development initiatives, from defense industry training to STEM education, cybersecurity and veterans’ career pathways, we are committed to helping build the talent pipeline that sustains Arizona’s security, innovation and prosperity,” Sandrin said.

In addition to his address, Hamadeh participated in a fireside chat with Danny Seiden, president and CEO of the Arizona Chamber of Commerce. Seiden earned his Juris Doctor from ASU’s Sandra Day O’Connor College of Law and is an adjunct professor in the college.

Hamadeh praised ASU’s work with veterans and, in particular, the Pat Tillman Veterans Center, which assists nearly 25,000 active-duty, veteran and military-connected students with their military education benefits and supports their transition to the civilian workforce and daily life.

“You want to see the university systems embrace our veterans to help them upskill, re-skill and get back out in the workforce,” Hamadeh said. “I think ASU does a great job with veterans.”

Hamadeh said he would encourage his fellow congressmen to visit universities to see how their research and innovation intertwines with national security.

“Sometimes universities operate as a silo, and some generals might not know what could be available for them in 10, 15 years from now, and what investments are going towards,” he said. “I think a delegation would be a good way to understand the university system, which has a direct link to so much of the advanced technologies.”

Hamadeh was introduced by Nadya Bliss, executive director of ASU’s Global Security Initiative.

At the beginning of her speech, Bliss asked a question:

“Internet, GPS, Siri, the computer mouse, autonomous vehicles, radar mapping — what do these all have in common?”

The answer, Bliss said, is that they all were developed with funding from the then-Department of Defense for national security purposes, with involvement of America’s universities.

“Our nation’s story of technological advancement over the last 60 years can largely be traced back to these and other defense research programs,” Bliss said. “And there is no one in this country who has not been impacted by that research, by the ideas developed on campuses like (the West Valley campus).”

Bliss noted that ASU is in the top 8% of universities for defense research.

“I have spent much of the last quarter century working in national security research and development, helping deliver new technology for the warfighter and people supporting them,” Bliss said. “And I can tell you, ASU truly is a unique organization, not just because of its size … but because of its culture, because of the people who believe in our mission, because it is unafraid to take risks or responsibility, because we want to move at the speed of relevance and have impact. Real impact on the problems our country is facing today and will face in the future.”

Bliss said part of that mission is to support and advance U.S. national security. She showed a slide that detailed many of ASU’s efforts in that regard.

Among them:

“There is so much going on that I could not possibly cover it all here,” Bliss said. “Universities are the seedbeds for our country’s new ideas and breakthroughs. No other type of organization can match the breadth of expertise and the depth of knowledge that exists at large-scale research universities like ASU.

“That combination can lead to incredible ingenuity. And when that ingenuity is coupled with mission needs and the types of problems we are trying to solve in areas like defense and national security, you can get world-changing ideas.”



When a person needs emergency services, the first person they speak with is rarely a firefighter, police officer or paramedic. It’s a 911 operator or call taker, broadly called public safety…

Wayne Johnson’s story is one of persistence across decades.A Vietnam veteran and a father, he had always dreamed of teaching at the college level. That dream, however, kept being delayed by the…

As both Arizona State University and Taiwan have become major players in Arizona’s burgeoning semiconductor industry, the university has worked to nurture its ties to the island.This fall, ASU…

Contact ASU News

Manage subscriptions",medicine
